{
  "findings": [],
  "input_fingerprints": {
    "_kapelle/surface-plan.json": "0273f0bd866a3226bbddc910fe91bfc5aef250105fa374c4c19fca27d90ab3ff",
    "_kapelle/task-plan.json#structural": "720e31c11c8ae68a8f18fc23e3a01235a172e2685cd20d824a49490c3955a2d6",
    "design.md": "612ef09c2111f594be19612235f5365538d18c7705911085815041ff9a4c8da9",
    "proposal.md": "ba3938d6ad08402d9f48d7b48fe9f89dd2e011d8c7c67755e1c965cd186c7159",
    "spec.md": "5b15e70e74f245943bf8e99f77b58c5abec9405a5c99add9e40b3860b9e9bdda",
    "tasks.md": "715247a022f9cdb3ec93ba86e20a33835e7a0c0ffcfc230e1890316a3fd081d0",
    "test-plan.md": "1c1400f5a12e0c57e6d25968745bf007ff6f2ec10d8e940d41033e74a90555ec"
  },
  "reviewed_aspects": [
    "contracts",
    "runtime",
    "stages",
    "documentation"
  ],
  "status": "PASS",
  "summary": "Clean-context architecture and adversarial feature review found no remaining source-level correctness defects after recovery, evidence, migration, and freshness fixes.",
  "validation_files": [
    "_kapelle/validation/T01.json",
    "_kapelle/validation/T02.json",
    "_kapelle/validation/T03.json",
    "_kapelle/validation/T04.json",
    "_kapelle/validation/T05.json",
    "_kapelle/validation/T06.json",
    "_kapelle/validation/T07.json",
    "_kapelle/validation/T08.json",
    "_kapelle/validation/T09.json"
  ]
}
